{
  "schema_version": "1.1",
  "event_id": "01KB12345678DEPLABCDEF1234",
  "tenant_id": "default",
  "resource_uid": "arn:aws:ecs:us-east-1:111122223333:service/cic-demo/api",
  "occurred_at": "2026-10-15T08:57:00Z",
  "ingested_at": "2026-10-15T08:57:04Z",
  "source": "github.actions",
  "commit_sha": "aaaaaaaaaaaaaaaaaaaaaaaaaaaaaaaaaaaaaaaa",
  "image_digest": "sha256:bbbbbbbbbbbbbbbbbbbbbbbbbbbbbbbbbbbbbbbbbbbbbbbbbbbbbbbbbbbbbbbb",
  "task_definition_arn": "arn:aws:ecs:us-east-1:111122223333:task-definition/cic-demo:9",
  "pipeline_run_id": "149000",
  "pipeline_run_url": "https://github.com/example/cloud-incident-commander/actions/runs/149000",
  "deployment_status": "SUCCEEDED",
  "correlation_id": "corr-01KB12345678"
}
